A1: Scaled Knight's (SS Quest) | B1: AC | C1: WT | D1: STR | E1: DEX | F1: STA | G1: AGI | H1: WIS | I1: INT | J1: CHA | K1: HP | L1: MANA | M1: SVF | N1: SVC | O1: SVD | P1: SVP | Q1: SVM | R1: Effect
A2: Scaled Knight's Helm | B2: 22 | C2: 5.5 | D2: 3 | E2: Å@ | F2: 6 | G2: Å@ | H2: 6 | I2: Å@ | J2: Å@ | K2: 30 | L2: Å@ | M2: Å@ | N2: 5 | O2: Å@ | P2: Å@ | Q2: 5 | R2: Å@
A3: Scaled Knight's Breastplate | B3: 50 | C3: 9 | D3: 14 | E3: 8 | F3: 4 | G3: 8 | H3: 9 | I3: Å@ | J3: Å@ | K3: 70 | L3: 60 | M3: Å@ | N3: Å@ | O3: 5 | P3: Å@ | Q3: 9 | R3: Shield of Words
A4: Scaled Knight's Vambracers | B4: 25 | C4: 6 | D4: 4 | E4: 3 | F4: 7 | G4: Å@ | H4: Å@ | I4: Å@ | J4: Å@ | K4: 50 | L4: Å@ | M4: 3 | N4: Å@ | O4: Å@ | P4: Å@ | Q4: 5 | R4: Å@
A5: Scaled Knight's Bracer | B5: 18 | C5: 3.5 | D5: 3 | E5: 2 | F5: 4 | G5: 2 | H5: 3 | I5: Å@ | J5: Å@ | K5: 10 | L5: 10 | M5: Å@ | N5: Å@ | O5: Å@ | P5: 1 | Q5: Å@ | R5: Å@
A6: Scaled Knight's Gauntlets | B6: 18 | C6: 4.5 | D6: 3 | E6: 1 | F6: 3 | G6: 1 | H6: 2 | I6: Å@ | J6: Å@ | K6: 40 | L6: 10 | M6: Å@ | N6: Å@ | O6: Å@ | P6: Å@ | Q6: 5 | R6: Å@
A7: Scaled Knight's Greaves | B7: 31 | C7: 7 | D7: 7 | E7: 10 | F7: 5 | G7: Å@ | H7: 7 | I7: Å@ | J7: Å@ | K7: 60 | L7: Å@ | M7: 4 | N7: 4 | O7: 4 | P7: 4 | Q7: 4 | R7: Å@
A8: Scaled Knight's Boots | B8: 24 | C8: 6 | D8: 3 | E8: 2 | F8: 6 | G8: 2 | H8: 2 | I8: Å@ | J8: Å@ | K8: Å@ | L8: Å@ | M8: Å@ | N8: Å@ | O8: 3 | P8: 3 | Q8: Å@ | R8: Å@
A9: Total | B9: =SUM(B2:B8) -> 188 | C9: =SUM(C2:C8) -> 41.5 | D9: =SUM(D2:D8) -> 37 | E9: =SUM(E2:E8) -> 26 | F9: =SUM(F2:F8) -> 35 | G9: =SUM(G2:G8) -> 13 | H9: =SUM(H2:H8) -> 29 | I9: =SUM(I2:I8) -> 0 | J9: =SUM(J2:J8) -> 0 | K9: =SUM(K2:K8) -> 260 | L9: =SUM(L2:L8) -> 80 | M9: =SUM(M2:M8) -> 7 | N9: =SUM(N2:N8) -> 9 | O9: =SUM(O2:O8) -> 12 | P9: =SUM(P2:P8) -> 8 | Q9: =SUM(Q2:Q8) -> 28 | R9: Å@
A11: Shining (Kael Quest) | B11: AC | C11: WT | D11: STR | E11: DEX | F11: STA | G11: AGI | H11: WIS | I11: INT | J11: CHA | K11: HP | L11: MANA | M11: SVF | N11: SVC | O11: SVD | P11: SVP | Q11: SVM | R11: Effect
A12: Shining Helm | B12: 27 | C12: 5.5 | D12: 3 | E12: 3 | F12: 3 | G12: Å@ | H12: 4 | I12: Å@ | J12: Å@ | K12: Å@ | L12: 30 | M12: Å@ | N12: Å@ | O12: 3 | P12: Å@ | Q12: 2 | R12: Å@
A13: Shining Breastplate | B13: 54 | C13: 9 | D13: 14 | E13: 7 | F13: 7 | G13: 7 | H13: 7 | I13: Å@ | J13: Å@ | K13: 50 | L13: 50 | M13: Å@ | N13: 4 | O13: Å@ | P13: Å@ | Q13: 8 | R13: Shield of Words
A14: Shining Vambracers | B14: 29 | C14: 6 | D14: 2 | E14: 2 | F14: Å@ | G14: Å@ | H14: 7 | I14: Å@ | J14: Å@ | K14: Å@ | L14: 30 | M14: Å@ | N14: Å@ | O14: Å@ | P14: 2 | Q14: 3 | R14: Å@
A15: Shining Bracer | B15: 21 | C15: 3.5 | D15: 3 | E15: 1 | F15: 2 | G15: 1 | H15: 2 | I15: Å@ | J15: Å@ | K15: 10 | L15: 10 | M15: 1 | N15: Å@ | O15: 1 | P15: Å@ | Q15: Å@ | R15: Å@
A16: Shining Gauntlets | B16: 21 | C16: 4.5 | D16: 4 | E16: 1 | F16: 1 | G16: 1 | H16: 2 | I16: Å@ | J16: Å@ | K16: Å@ | L16: 10 | M16: Å@ | N16: Å@ | O16: Å@ | P16: Å@ | Q16: 2 | R16: Å@
A17: Shining Greaves | B17: 36 | C17: 7 | D17: 10 | E17: Å@ | F17: 6 | G17: Å@ | H17: 6 | I17: Å@ | J17: Å@ | K17: 70 | L17: Å@ | M17: 1 | N17: 1 | O17: 1 | P17: 1 | Q17: 1 | R17: Å@
A18: Shining Boots | B18: 28 | C18: 6 | D18: 4 | E18: Å@ | F18: Å@ | G18: Å@ | H18: 4 | I18: Å@ | J18: Å@ | K18: Å@ | L18: Å@ | M18: Å@ | N18: Å@ | O18: Å@ | P18: Å@ | Q18: Å@ | R18: Å@
A19: Total | B19: =SUM(B12:B18) -> 216 | C19: =SUM(C12:C18) -> 41.5 | D19: =SUM(D12:D18) -> 40 | E19: =SUM(E12:E18) -> 14 | F19: =SUM(F12:F18) -> 19 | G19: =SUM(G12:G18) -> 9 | H19: =SUM(H12:H18) -> 32 | I19: =SUM(I12:I18) -> 0 | J19: =SUM(J12:J18) -> 0 | K19: =SUM(K12:K18) -> 130 | L19: =SUM(L12:L18) -> 130 | M19: =SUM(M12:M18) -> 2 | N19: =SUM(N12:N18) -> 5 | O19: =SUM(O12:O18) -> 5 | P19: =SUM(P12:P18) -> 3 | Q19: =SUM(Q12:Q18) -> 16 | R19: Å@