B1: Standard Gear
T2: Stat | U2: Base | V2: Gear | W2: Actual
B3: Item | C3: AC | D3: WGT | E3: STR | F3: STA | G3: AGI | H3: DEX | I3: WIS | J3: INT | K3: CHA | L3: MN | M3: HP | N3: F | O3: D | P3: C | Q3: M | R3: P | T3: STR | U3: 60 | V3: =E24 -> 21 | W3: =U3+V3 -> 81
B4: Electrum Blue Diamond Ear | C4: 0 | D4: 00.1 | L4: 15 | N4: 6 | O4: 11 | P4: 6 | Q4: 4 | R4: 11 | T4: STA | U4: 75 | V4: =F24 -> 28 | W4: =U4+V4 -> 103
B5: Electrum Blue Diamond Ear | C5: 0 | D5: 00.1 | L5: 15 | N5: 6 | O5: 11 | P5: 6 | Q5: 4 | R5: 11 | T5: AGI | U5: 85 | V5: =G24 -> 24 | W5: =U5+V5 -> 109
B6: Ionat's Talisman | C6: 7 | D6: 00.1 | E6: 6 | F6: 6 | G6: 6 | H6: 6 | I6: 6 | J6: 6 | K6: 6 | L6: 30 | M6: 30 | N6: 6 | O6: 6 | P6: 6 | Q6: 6 | R6: 6 | S6: ND | T6: DEX | U6: 75 | V6: =H24 -> 11 | W6: =U6+V6 -> 86
B7: Golden Diamond Mask | C7: 0 | D7: 00.1 | N7: 10 | O7: 5 | P7: 10 | Q7: 3 | R7: 5 | T7: WIS | U7: 95 | V7: =I24 -> 36 | W7: =U7+V7 -> 131
B8: Summoners Circlet (Kael) | C8: 8 | D8: 00.2 | J8: 10 | L8: 25 | M8: 25 | O8: 5 | Q8: 7 | S8: ND | T8: INT | U8: 122 | V8: =J24 -> 111 | W8: =U8+V8 -> 233
B9: Velium Diamond Ring | C9: 0 | D9: 00.1 | N9: 8 | O9: 8 | P9: 8 | Q9: 8 | R9: 8 | T9: CHA | U9: 80 | V9: =K24 -> 6 | W9: =U9+V9 -> 86
B10: Velium Diamond Ring | C10: 0 | D10: 00.1 | N10: 8 | O10: 8 | P10: 8 | Q10: 8 | R10: 8 | T10: MS | V10: =L24 -> 565 | W10: =U10+V10 -> 565
B11: Velium Blue Diamond Bracer | C11: 0 | D11: 00.1 | L11: 30 | N11: 9 | O11: 9 | P11: 11 | Q11: 9 | R11: 9 | T11: HP | V11: =M24 -> 305 | W11: =U11+V11 -> 305
B12: Velium Blue Diamond Bracer | C12: 0 | D12: 00.1 | L12: 30 | N12: 9 | O12: 9 | P12: 11 | Q12: 9 | R12: 9 | T12: F | U12: 25 | V12: =N24 -> 118 | W12: =U12+V12 -> 143
B13: Summoners Sleeves (Kael) | C13: 8 | D13: 00.4 | F13: 4 | J13: 7 | L13: 25 | M13: 25 | P13: 4 | S13: ND | T13: D | U13: 15 | V13: =O24 -> 102 | W13: =U13+V13 -> 117
B14: Summoners Gloves (Kael) | C14: 7 | D14: 00.4 | G14: 10 | J14: 10 | L14: 20 | M14: 25 | N14: 3 | O14: 3 | P14: 3 | Q14: 3 | R14: 3 | S14: ND | T14: C | U14: 25 | V14: =P24 -> 121 | W14: =U14+V14 -> 146
B15: Loam Encrusted Amice | C15: 4 | D15: 00.3 | G15: 8 | J15: 3 | L15: 10 | N15: 2 | O15: 2 | P15: 2 | Q15: 2 | R15: 2 | T15: M | U15: 20 | V15: =Q24 -> 119 | W15: =U15+V15 -> 139
B16: Robe of the Azure Sky | C16: 18 | D16: 0.5 | I16: 20 | J16: 20 | L16: 100 | M16: 85 | N16: 15 | O16: 15 | P16: 15 | Q16: 15 | R16: 15 | S16: ND | T16: P | U16: 15 | V16: =R24 -> 97 | W16: =U16+V16 -> 112
B17: Mystic Cloak | C17: 8 | D17: 00.1 | J17: 5 | Q17: 5 | S17: ND | T17: AC | V17: 69
B18: Grotesque Girdle | C18: 8 | D18: 0.0 | I18: 10 | J18: 10 | L18: 100 | M18: 100 | N18: 5 | Q18: 5 | S18: ND
B19: Summoners Legs (Kael) | C19: 8 | D19: 0.5 | F19: 5 | J19: 5 | L19: 20 | N19: 3 | O19: 2 | P19: 3 | Q19: 3 | R19: 2 | S19: ND
B20: Summoners Boots (Kael) | C20: 7 | D20: 00.4 | F20: 3 | J20: 4 | L20: 20 | M20: 15 | N20: 3 | O20: 3 | P20: 3 | Q20: 3 | R20: 3 | S20: ND
B21: Students Homework | C21: 0 | D21: 1 | J21: 3 | L21: 15 | Q21: 10
B22: Ornate Runed Shield | C22: 15 | D22: 3.0 | J22: 8 | L22: 10 | N22: 5 | O22: 5 | P22: 5 | Q22: 5 | R22: 5
B23: Orb of Mastery | C23: 0 | D23: 1.0 | E23: 15 | F23: 10 | H23: 5 | J23: 20 | L23: 100 | N23: 20 | P23: 20 | Q23: 10 | S23: ND
B24: 6/25 | C24: =SUM(C4:C23) -> 98 | D24: =SUM(D4:D23) -> 8.6 | E24: =SUM(E4:E23) -> 21 | F24: =SUM(F4:F23) -> 28 | G24: =SUM(G4:G23) -> 24 | H24: =SUM(H4:H23) -> 11 | I24: =SUM(I4:I23) -> 36 | J24: =SUM(J4:J23) -> 111 | K24: =SUM(K4:K23) -> 6 | L24: =SUM(L4:L23) -> 565 | M24: =SUM(M4:M23) -> 305 | N24: =SUM(N4:N23) -> 118 | O24: =SUM(O4:O23) -> 102 | P24: =SUM(P4:P23) -> 121 | Q24: =SUM(Q4:Q23) -> 119 | R24: =SUM(R4:R23) -> 97
B26: Resistance Gear
B27: Item | C27: AC | D27: WGT | E27: STR | F27: STA | G27: AGI | H27: DEX | I27: WIS | J27: INT | K27: CHA | L27: MN | M27: HP | N27: F | O27: D | P27: C | Q27: M | R27: P
B28: Apothic Arms | C28: 4 | D28: 00.4 | J28: 7 | M28: 18 | N28: 10 | S28: ND
B29: Apothic Boots | C29: 4 | D29: 00.7 | G29: 13 | R29: 10 | S29: ND
B30: Apothic Crown | C30: 5 | D30: 00.3 | J30: 9 | K30: 10 | L30: 10 | M30: 10 | Q30: 10 | S30: ND
B31: Apothic Gloves | C31: 4 | D31: 00.4 | H31: 13 | J31: 7 | L31: 12 | O31: 10 | S31: ND
B32: Apothic Kilt | C32: 5 | D32: 0.5 | E32: 5 | M32: 25 | P32: 10 | S32: ND
B33: Loam Encrusted Sash | C33: 4 | D33: 00.2 | E33: 8 | L33: 10 | M33: 8 | N33: 5 | Q33: 5
B34: Crown of the Froglok Kings | C34: 12 | D34: 0.5 | N34: 20 | P34: 20
B35: Stein of Mogguk | C35: 0 | D35: 2.5 | H35: 5 | J35: 10 | M35: 10 | O35: 25
B36: Rainment of the Chosen | C36: 22 | D36: 2.5 | J36: 16 | O36: 10 | R36: 10 | S36: ND
N37: =SUM(N28:N36) -> 35 | O37: =SUM(O28:O36) -> 45 | P37: =SUM(P28:P36) -> 30 | Q37: =SUM(Q28:Q36) -> 15 | R37: =SUM(R28:R36) -> 20
B39: Secondary Situational Gear
B40: Item | C40: AC | D40: WGT | E40: STR | F40: STA | G40: AGI | H40: DEX | I40: WIS | J40: INT | K40: CHA | L40: MN | M40: HP | N40: F | O40: D | P40: C | Q40: M | R40: P | S40: ND
B41: Mithril Mask | C41: 5 | D41: 00.8 | I41: 7 | J41: 7 | S41: ND
B42: Wristband of Conjuration | C42: 4 | D42: 00.3 | G42: 5 | J42: 2 | L42: 10 | M42: 10 | N42: 1 | O42: 1 | P42: 2 | Q42: 1 | R42: 2 | S42: ND
B43: Sleeves of Conjuration | C43: 6 | D43: 00.4 | F43: 4 | J43: 5 | L43: 15 | M43: 15 | N43: 2 | S43: ND
B44: Gloves of the Bladecaller | C44: 2 | D44: 0 | F44: 3 | J44: 3 | L44: 10 | S44: ND
B45: Apothic Robe | C45: 11 | D45: 1.0 | F45: 12 | H45: 5 | J45: 14 | L45: 40 | S45: ND
B46: Robe of Conjuration | C46: 12 | D46: 0.5 | F46: 14 | J46: 15 | N46: 5 | O46: 5 | P46: 5 | Q46: 5 | R46: 5 | S46: ND
B47: Fatesealer 9/18 1HB | C47: 0 | D47: 3.5 | E47: 4 | H47: 4 | I47: 8 | J47: 8 | L47: 75 | M47: 75